"Participant id","Technique","Granularity","Language","Block no","Condition no","Stimuli","User Response","Trial Start Time","Trial End Time","Trial Time","Accuracy"
"P01","TRADITIONAL","phrase","English","2","21","pervades this holy place","pervades this holy place","1442152099286","1442152116072","16786","1"
"P01","TRADITIONAL","phrase","Latin","2","22","ante id sem tincidunt","ante id sem tincidunt","1442152116072","1442152119271","3199","1"
"P01","TRADITIONAL","sentence","English","2","23","Reluctantly, I hoisted the chalice to my lips.","Reluctantly, I hoisted the chalice to my lips.","1442152119287","1442152130141","10854","1"
"P01","TRADITIONAL","sentence","Latin","2","24","Praesent et nunc sollicitudin, vestibulum diam non, ultricies ligula.","Praesent et nunc sollicitudin, vestibulum diam non, ultricies ligula.","1442152130141","1442152146161","16020","1"
"P01","AUTOCOMPASTE","paragraph","English","2","25","We had arrived in the middle of a funeral ceremony, a complex ritual that, despite all the assaults of the modern world, remained almost identical to those described by Chagnon a quarter century earlier.","We had arrived in the middle of a funeral ceremony, a complex ritual that, despite all the assaults of the modern world, remained almost identical to those described by Chagnon a quarter century earlier.","1442152146162","1442152152986","6824","1"
"P01","AUTOCOMPASTE","paragraph","Latin","2","26","Maecenas rutrum, mi ac bibendum ultrices, nulla lorem pharetra orci, sed mollis urna lorem sit amet mi. Vestibulum gravida id massa in commodo.","Maecenas rutrum, mi ac bibendum ultrices, nulla lorem pharetra orci, sed mollis urna lorem sit amet mi. Vestibulum gravida id massa in commodo.","1442152152987","1442152168301","15314","1"
"P01","AUTOCOMPASTE","phrase","English","2","27","sample such delicacies as the","sample such delicacies as the","1442152168302","1442152177734","9432","1"
"P01","AUTOCOMPASTE","phrase","Latin","2","28","aliquet et dolor mattis","aliquet et dolor mattis","1442152177734","1442152185932","8198","1"
"P01","AUTOCOMPASTE","sentence","English","2","29","Yet we could see that certain traditions were still intact.","Yet we could see that certain traditions were still intact.","1442152185932","1442152189867","3935","1"
"P01","AUTOCOMPASTE","sentence","Latin","2","30","Donec eleifend arcu nisi, sed dapibus nunc facilisis eget.","Donec eleifend arcu nisi, sed dapibus nunc facilisis eget.","1442152189867","1442152194431","4564","1"
"P01","TRADITIONAL","paragraph","English","2","31","This means that there is need for a regular sequence of new editions, normally one or two per year achieving that sequence can pose problems for the Editorial Secretary, who may have too few or too many texts ready for publication at any one time.","This means that there is need for a regular sequence of new editions, normally one or two per year achieving that sequence can pose problems for the Editorial Secretary, who may have too few or too many texts ready for publication at any one time.","1442152194431","1442152204071","9640","1"
"P01","TRADITIONAL","paragraph","Latin","2","32","Cras scelerisque convallis elit, quis cursus justo auctor non. Aenean congue tortor vel ullamcorper lacinia. Proin elementum ullamcorper efficitur.","Cras scelerisque convallis elit, quis cursus justo auctor non. Aenean congue tortor vel ullamcorper lacinia. Proin elementum ullamcorper efficitur.","1442152204071","1442152207273","3202","1"
"P01","TRADITIONAL","phrase","English","2","33","propagate and split as they","propagate and split as they","1442152207273","1442152217782","10509","1"
"P01","TRADITIONAL","phrase","Latin","2","34","augue porta maximus congue","augue porta maximus congue","1442152217782","1442152223982","6200","1"
"P01","TRADITIONAL","sentence","English","2","35","These made World War II the deadliest conflict in human history.","These made World War II the deadliest conflict in human history.","1442152223982","1442152233067","9085","1"
"P01","TRADITIONAL","sentence","Latin","2","36","Etiam purus mauris, finibus et fermentum sed, commodo ac lorem.","Etiam purus mauris, finibus et fermentum sed, commodo ac lorem.","1442152233067","1442152238847","5780","1"